{"schema_version":"villani.artifact_descriptor.v2","artifact_id":"artifact_patch_001","digest":{"algorithm":"sha256","value":"aaaaaaaaaaaaaaaaaaaaaaaaaaaaaaaaaaaaaaaaaaaaaaaaaaaaaaaaaaaaaaaa"},"size_bytes":128,"media_type":"text/x-diff","logical_role":"candidate.patch","sensitivity":"internal","retention_class":"run","encryption_status":"unencrypted","storage_reference":"runs/run_001/attempts/attempt_001/patch.diff","provenance_status":"recorded","attributes":{}}
